{
  "meta": {
    "file_number": 50,
    "format": "carousel",
    "carousel_category": "warning（警告・逆効果型）",
    "euphemism": "不要（直接表現可）",
    "phase": "均等配置（フェーズ区分なし）",
    "phase_role": "パッケージ2の警告カテゴリ3本（File.40／File.50／File.60）の中間作。乾燥への過信・靴下素材の軽視・靴だけの対策という3つの見落としを、断定や脅しではなく、和男自身が12年間気づかずにいたという正直な気づきとして提示する。File.47・File.57のチェックリスト系と同様、断定を避ける方針を踏襲する。"
  },
  "purpose": "安全靴ユーザーが見落としがちな3つの落とし穴（①「乾燥させれば大丈夫」の過信、②靴下の素材を気にしない、③足そのものではなく靴だけ対策している）を提示し、断定や脅しではなく、僕自身が12年間気づかずにいたという正直な経験として共有する。",
  "target_state": "安全靴を履く仕事をしていて、乾燥対策や消臭スプレーなど何らかの対策はしているが、靴下の素材や足そのものへのケアまでは意識が向いていない状態。このカルーセルを偶然見かけた状態。直列視聴を前提にしない。",
  "logic": [
    "①「乾燥させれば大丈夫」という過信、②靴下の素材を気にしない、③足そのものではなく靴だけ対策している、という3つの見落としを順に提示する",
    "僕自身も12年間、この3つを見落としていたという正直な告白を挟む",
    "気づいた時には対策の方向がズレたまま何年も経っていたという振り返りを示し、『落とし穴は、気づかないから落とし穴』という気づきで締める"
  ],
  "psychology": {
    "entry": "1枚目（表紙）で『安全靴ユーザーが見落としがちな落とし穴3つ』というフックを提示し、読者が自分の対策に抜けがないか気になる状態を作る",
    "exit": "『落とし穴は、気づかないから落とし穴』という気づきを最終スライドで残し、読者が自分の対策を振り返るきっかけとして保存させる"
  },
  "carousel_guideline": {
    "slide_count": 7,
    "cover_hook": "安全靴と戦う12年の記録：File.50｜安全靴ユーザーが見落としがちな落とし穴3つ",
    "content_direction": "warning型。①「乾燥させれば大丈夫」の過信、②靴下の素材を気にしない、③足そのものではなく靴だけ対策している、という3つの見落としを順に提示し、断定的な警告としてではなく、僕自身が12年間気づかずにいたという正直な経験として示す。",
    "closing_message": "落とし穴は、気づかないから落とし穴です。",
    "reference_files": [],
    "cta_required": false
  },
  "slides": [
    {
      "slide_number": 1,
      "content": "安全靴と戦う12年の記録：File.50を表示。『安全靴ユーザーが見落としがちな落とし穴3つ』というフック文言を配置する。",
      "role": "cover"
    },
    {
      "slide_number": 2,
      "content": "①「乾燥させれば大丈夫」の過信について提示する。乾燥させることだけで対策が完結すると思い込んでいた見落としを、断定せず淡々と示す。",
      "role": "content"
    },
    {
      "slide_number": 3,
      "content": "②靴下の素材を気にしないことについて提示する。靴だけでなく靴下の素材が対策に影響することを見落としていた点を、断定せず淡々と示す。",
      "role": "content"
    },
    {
      "slide_number": 4,
      "content": "③足そのものではなく靴だけ対策していることについて提示する。靴の対策に偏り、足自身のケアが抜けていた見落としを、断定せず淡々と示す。",
      "role": "content"
    },
    {
      "slide_number": 5,
      "content": "僕も12年間、この3つを見落としていたという正直な告白を配置する。断定せず、あくまで自分自身の経験として示す。",
      "role": "personal_comment"
    },
    {
      "slide_number": 6,
      "content": "気づいた時には対策の方向がズレたまま何年も経っていたという振り返りを配置する。反省の押し付けにならないよう淡々としたトーンで示す。",
      "role": "content"
    },
    {
      "slide_number": 7,
      "content": "『落とし穴は、気づかないから落とし穴』という気づきを締めのメッセージとして配置する。",
      "role": "summary"
    }
  ],
  "thumbnail_guideline": {
    "direction": "虫眼鏡や注意サインを連想させるが、過度に煽らない構図。白・グレー系の背景に控えめなアンバー系のアクセント。余白を多く取る。テキストは見落としへの気づきを促す短文。断定的な警告調は避ける。",
    "tone": "誠実・冷静・自分ごと化を促す",
    "selected_text": ["安全靴の", "見落としがち", "な落とし穴", "3つ"]
  },
  "caption": {
    "hook_line": "安全靴ユーザーが見落としがちな落とし穴3つ、僕も12年間気づいていませんでした。",
    "body": "乾燥させれば大丈夫という過信、靴下の素材への無頓着、靴だけの対策。\n工場勤務12年の中で、僕自身がずっと見落としていた3つです。",
    "cta": "落とし穴は、気づかないから落とし穴だと思います。よかったら自分の対策も振り返ってみてください。",
    "hashtags": ["#安全靴", "#工場勤務", "#足元ケア", "#12年の記録", "#見落とし"]
  },
  "tone_and_rules": {
    "persona": "共感共闘型・和男（30代中旬・工場勤務12年・足元の悩みの当事者）",
    "slide_max_chars": 60,
    "sentence_ending": "です・ます",
    "prohibited_words": [
      "効", "治", "消え", "改善", "変わ", "変化", "変え", "解決", "完全", "劇的", "即効",
      "必ず", "絶対", "確実に", "限定", "今だけ", "残りわずか",
      "足のニオイ", "足が臭い", "悪臭", "臭い足", "足臭", "体臭"
    ],
    "one_message": "安全靴ユーザーが見落としがちな3つの落とし穴（乾燥への過信・靴下素材の軽視・靴だけの対策）を、僕自身の12年間の経験として正直に提示したカルーセル",
    "numbering": "安全靴と戦う12年の記録：File.50"
  },
  "honesty_rule": {
    "effect_claim": "効果を断定も暗示もしない。「効」「治」「消え」「改善」を含む全活用形は禁止。",
    "guarantee": "保証しない。「必ず」「絶対」「確実に」は禁止。",
    "purchase_pressure": "合わない人が買う確率を下げる設計。購入を急かす・限定感を出す表現は禁止。",
    "tone_consistency": "気にならなくなった・保証しない・よかったら。この3語のトーンを一貫する。"
  },
  "euphemism_dict": {
    "prohibited_direct": [
      "足のニオイ", "足が臭い", "悪臭", "臭い足", "足臭", "体臭",
      "蒸れ臭", "雑菌", "腐敗臭", "発酵臭", "殺菌", "除菌", "ニオイ対策"
    ],
    "conversion_table": {}
  }
}
