{
  "meta": {
    "file_number": 31,
    "format": "reel",
    "psychology_type": "Type_2（ナラティブ・サスペンス型）",
    "euphemism": "要（足元の違和感・出所を聞かれた沈黙）",
    "phase": "均等配置（フェーズ区分なし）",
    "phase_role": "パッケージ2の入口。職場で同僚から「足大丈夫か」と聞かれた瞬間の沈黙。DMシェア誘発力が高い"
  },
  "purpose": "パッケージ2の入口として、同僚に「お前、足大丈夫か」と聞かれた瞬間、何と答えていいか分からず言葉に詰まる、その当事者だけの沈黙を可視化し、「自分だけじゃない」という共感とDMシェアを誘発する。CTAなしで正直さの信頼蓄積を継続する。",
  "target_state": "足元の違和感を抱えているが誰にも言えず一人で対処している。職場で同僚に何気なく体調や様子を聞かれてドキッとした経験がある。このReelsを偶然見かけた状態。直列視聴を前提にしない。",
  "logic": [
    "休憩室で同僚から不意に「お前、足大丈夫か？」と聞かれる。深い意味のない一言のはずなのに、核心を突かれた感覚が走る",
    "何と答えるべきか、頭の中で数パターンの返答がよぎるが、結局「大丈夫です」としか言えない",
    "同僚はもう次の話題に移っているのに、自分だけがその一言を引きずっている、この温度差が当事者だけの共通体験"
  ],
  "psychology": {
    "entry": "日常の緊張場面：休憩中に同僚から「お前、足大丈夫か？」と不意に聞かれる、その一言で視聴者を拾う",
    "exit": "自分だけじゃない安心：「この人も同僚の何気ない一言にドキッとしたことがあるんだ」という共感による孤独感の緩和"
  },
  "narration_guideline": {
    "direction": "休憩室で同僚に「お前、足大丈夫か？」と聞かれた瞬間から、「大丈夫です」としか言えなかった沈黙までを和男の内面独白として語る。深い意味のない一言に核心を突かれた焦りと、平静を装う対応の落差を55〜65字で凝縮。結論や答えは出さず、共感の余韻で終わる。",
    "key_emotion": "動揺（何気ない一言に核心を突かれた焦り）",
    "opening_approach": "イン・メディアス・レス。同僚に「お前、足大丈夫か？」と聞かれた瞬間から即座に入る。「足元の悩みがあって…」等の背景説明は一切入れない。"
  },
  "telop_guideline": {
    "direction": "ナレーションの動揺を補完する気づき。「大丈夫です、としか言えなかった」という沈黙の重さを短い言葉で視覚的に突きつける。共感の余韻で終わる。CTAなし。",
    "cta_required": false,
    "cta_direction": null
  },
  "thumbnail_guideline": {
    "direction": "職場の休憩室、同僚からの何気ない一言で凍りつく瞬間の緊張感を、当事者だけが分かるフックとして提示",
    "tone": "共感・動揺の静けさ",
    "selected_text": [
      "足大丈夫か",
      "その一言で",
      "凍りついた"
    ]
  },
  "caption": {
    "hook_line": "同僚に「お前、足大丈夫か？」と聞かれた瞬間、頭が真っ白になりました。",
    "body": "安全靴を12年履いてきた僕にとって、休憩中の何気ない一言が一番怖いものでした。\n深い意味なんてないと分かっていても、核心を突かれた気がして言葉に詰まる。\n結局「大丈夫です」としか言えないまま、その日はずっとその一言を引きずっていました。",
    "cta": "同じ経験がある方へ。僕が12年間で試したことを、盛らずに全部プロフィールにまとめています。",
    "hashtags": [
      "#安全靴",
      "#工場勤務",
      "#足元ケア",
      "#健康習慣",
      "#体の内側から"
    ]
  },
  "tone_and_rules": {
    "persona": "共感共闘型・和男（30代中旬・工場勤務12年・足元の悩みの当事者）",
    "narration_duration": "55〜65字",
    "telop_lines": "2〜4行",
    "telop_max_chars_per_line": 10,
    "sentence_ending": "です・ます",
    "prohibited_words": [
      "効", "治", "消え", "改善", "変わ", "変化", "変え", "解決", "完全", "劇的", "即効",
      "必ず", "絶対", "確実に", "限定", "今だけ", "残りわずか",
      "足のニオイ", "足が臭い", "悪臭", "臭い足", "足臭", "体臭"
    ],
    "one_message": "同僚に「お前、足大丈夫か？」と聞かれた瞬間、何気ない一言のはずなのに核心を突かれた気がして言葉に詰まる、あなただけじゃない",
    "numbering": "安全靴と戦う12年の記録：File.31"
  },
  "honesty_rule": {
    "effect_claim": "効果を断定も暗示もしない。「効」「治」「消え」「改善」を含む全活用形は禁止。",
    "guarantee": "保証しない。「必ず」「絶対」「確実に」は禁止。",
    "purchase_pressure": "合わない人が買う確率を下げる設計。購入を急かす・限定感を出す表現は禁止。",
    "tone_consistency": "気にならなくなった・保証しない・よかったら。この3語のトーンを一貫する。"
  },
  "euphemism_dict": {
    "prohibited_direct": [
      "足のニオイ", "足が臭い", "悪臭", "臭い足", "足臭", "体臭",
      "蒸れ臭", "雑菌", "腐敗臭", "発酵臭", "殺菌", "除菌", "ニオイ対策"
    ],
    "conversion_table": {
      "足のニオイ": ["足元の違和感", "足元の悩み"],
      "臭い": ["気になる", "違和感がある"],
      "体臭": ["体の内側の問題", "内側のケア"],
      "蒸れ": ["靴の中の環境", "密閉後の空気"],
      "雑菌": ["蓄積したもの", "靴の内側の問題"],
      "腐敗": ["独特の気配", "あの感覚"],
      "発酵": ["密閉の影響", "靴の中の変化"],
      "ニオイ対策": ["足元ケア", "足元と向き合う"],
      "なくな": ["気にならなくな", "落ち着く"],
      "殺菌": ["清潔にする", "環境を整える"],
      "除菌": ["靴の内側を整える"],
      "解決": ["向き合う", "試したこと"],
      "完全": ["できる範囲で", "自分なりに"],
      "劇的": ["じわじわと", "少しずつ"],
      "即効": ["じっくりと", "続けることで"]
    }
  }
}
