{
  "meta": {
    "file_number": 54,
    "format": "carousel",
    "carousel_category": "comparison（比較・検証型）",
    "euphemism": "不要（直接表現可）",
    "phase": "均等配置（フェーズ区分なし）",
    "phase_role": "パッケージ2の比較・検証カテゴリ3本（File.34／File.44／File.54）の最終作。File.53（通販で買った消臭グッズが全部ハズレだった話）の体験を土台に、市販の消臭アイテム5種をコストと持続時間という具体的な軸で比較表として整理する保存狙いのカルーセル。断定は一切しない。ep49・ep53で使用した『期待して〜気づけば手が止まり』型の反復表現パターンは踏襲せず、コスト・持続時間という数値軸中心の構成にすることで言い回しを差別化する。"
  },
  "purpose": "市販の消臭アイテム5種（携帯用消臭ミスト・活性炭シート・消臭パウダー・乾燥剤・重曹ボール）について、コストと持続時間、和男の体感を正直に並べて比較する。どれかを推奨するのではなく、事実だけを淡々と提示し、保存・見返す価値のある実用コンテンツとして信頼を積み重ねる。",
  "target_state": "安全靴を履く仕事をしていて、市販の消臭アイテムをこれから試そうか迷っている、あるいは複数試したがどれがコストに見合うか比較したことがない状態。このカルーセルを偶然見かけた状態。直列視聴を前提にしない。",
  "logic": [
    "ep53で触れた通販購入の経験を踏まえ、代表的な市販消臭アイテム5種を挙げ、それぞれのコスト・持続時間・和男の体感を淡々と提示する",
    "高い・安い、持続時間が長い・短いという違いを断定的な優劣にせず、事実として並べる",
    "『どれが正解かは言えない。僕の体感を正直に並べただけ』という締めで、読者自身の比較検討に委ねる"
  ],
  "psychology": {
    "entry": "1枚目（表紙）で『市販消臭アイテム5種、コストと持続時間を正直に比較』というフックを提示し、何を選べばいいか迷っている読者の意思決定ニーズを引き出す",
    "exit": "『どれが正解かは言えない。僕の体感を正直に並べただけ』という締めを最終スライドで残し、読者が自分の判断材料として保存するきっかけを作る"
  },
  "carousel_guideline": {
    "slide_count": 7,
    "cover_hook": "安全靴と戦う12年の記録：File.54｜市販消臭アイテム5種 コストと持続時間の正直な比較",
    "content_direction": "comparison型。①携帯用消臭ミスト、②靴用の活性炭シート、③靴下にふりかける消臭パウダー、④靴の中に入れる乾燥剤、⑤靴の中に置く重曹ボールという5種類のアイテムについて、コスト・持続時間・和男の体感を軸ごとに淡々と比較提示する。優劣の断定はせず、事実の列挙に徹する。",
    "closing_message": "どれが「正解」かは言えません。僕の体感を正直に並べただけです。",
    "reference_files": [53],
    "cta_required": false
  },
  "slides": [
    {
      "slide_number": 1,
      "content": "安全靴と戦う12年の記録：File.54を表示。『市販消臭アイテム5種 コストと持続時間の正直な比較』というフック文言を配置する。",
      "role": "cover"
    },
    {
      "slide_number": 2,
      "content": "①携帯用消臭ミストについて提示する。コストは1本800円前後、持続時間は体感で数時間ほど。使った直後は気分が上向くが、長くは続かなかったという正直な感想を淡々と示す。",
      "role": "content"
    },
    {
      "slide_number": 3,
      "content": "②靴用の活性炭シートについて提示する。コストは1組1,200円前後、持続時間は体感で1〜2週間ほど。使い始めは良い感触があったが、徐々に手応えを感じにくくなったという事実を淡々と示す。",
      "role": "content"
    },
    {
      "slide_number": 4,
      "content": "③靴下にふりかける消臭パウダーについて提示する。コストは1本1,500円前後、持続時間は体感で1日程度。朝ふりかけても夕方には手応えが薄れていたという事実を淡々と示す。",
      "role": "content"
    },
    {
      "slide_number": 5,
      "content": "④靴の中に入れる乾燥剤について提示する。コストは1セット2,000円前後、持続時間は体感で数日ほど。湿気を感じにくくなる時間はあったが、根本的な違いは感じなかったという事実を淡々と示す。",
      "role": "content"
    },
    {
      "slide_number": 6,
      "content": "⑤靴の中に置く重曹ボールについて提示する。コストは1個1,000円前後、持続時間は体感で1ヶ月ほど。手軽さはあったが、他のアイテムと比べて突出した手応えは感じなかったという事実を淡々と示す。",
      "role": "content"
    },
    {
      "slide_number": 7,
      "content": "『どれが正解かは言えない。僕の体感を正直に並べただけ』という締めのメッセージを配置する。",
      "role": "summary"
    }
  ],
  "thumbnail_guideline": {
    "direction": "5種類のアイテムを整理して比べているような構図（スプレー・シート・粉・乾燥剤・ボールを連想させるアイコン的レイアウト）。白・グレー系の背景をベースに、余白を多く取る。テキストは比較・検証への興味を引く短文。過度な煽りは避ける。",
    "tone": "誠実・冷静・実用的（煽りではない）",
    "selected_text": ["市販消臭", "アイテム", "5種比較", "正直に検証"]
  },
  "caption": {
    "hook_line": "市販の消臭アイテム5種、コストと持続時間を正直に比較しました。",
    "body": "工場勤務12年の中で、通販や店頭で見つけた消臭アイテムを色々試してきました。\n今回はその中から代表的な5種類を選び、コストと持続時間、僕自身の体感を正直に並べてみました。\nどれも一長一短で、これが正解と言えるものはありませんでした。",
    "cta": "気になるものがあれば、参考にしてもらえたら嬉しいです。よかったら保存しておいてください。",
    "hashtags": ["#安全靴", "#工場勤務", "#足元ケア", "#12年の記録", "#コスト比較"]
  },
  "tone_and_rules": {
    "persona": "共感共闘型・和男（30代中旬・工場勤務12年・足元の悩みの当事者）",
    "slide_max_chars": 60,
    "sentence_ending": "です・ます",
    "prohibited_words": [
      "効", "治", "消え", "改善", "変わ", "変化", "変え", "解決", "完全", "劇的", "即効",
      "必ず", "絶対", "確実に", "限定", "今だけ", "残りわずか",
      "足のニオイ", "足が臭い", "悪臭", "臭い足", "足臭", "体臭"
    ],
    "one_message": "市販の消臭アイテム5種について、コストと持続時間、和男の体感を正直に並べて比較したカルーセル",
    "numbering": "安全靴と戦う12年の記録：File.54"
  },
  "honesty_rule": {
    "effect_claim": "効果を断定も暗示もしない。「効」「治」「消え」「改善」を含む全活用形は禁止。",
    "guarantee": "保証しない。「必ず」「絶対」「確実に」は禁止。",
    "purchase_pressure": "合わない人が買う確率を下げる設計。購入を急かす・限定感を出す表現は禁止。",
    "tone_consistency": "気にならなくなった・保証しない・よかったら。この3語のトーンを一貫する。"
  },
  "euphemism_dict": {
    "prohibited_direct": [
      "足のニオイ", "足が臭い", "悪臭", "臭い足", "足臭", "体臭",
      "蒸れ臭", "雑菌", "腐敗臭", "発酵臭", "殺菌", "除菌", "ニオイ対策"
    ],
    "conversion_table": {
      "足のニオイ": ["足元の違和感", "足元の悩み"],
      "臭い": ["気になる", "違和感がある"],
      "体臭": ["体の内側の問題", "内側のケア"],
      "蒸れ": ["靴の中の環境", "密閉後の空気"],
      "雑菌": ["蓄積したもの", "靴の内側の問題"],
      "腐敗": ["独特の気配", "あの感覚"],
      "発酵": ["密閉の影響", "靴の中の変化"],
      "ニオイ対策": ["足元ケア", "足元と向き合う"],
      "なくな": ["気にならなくな", "落ち着く"],
      "殺菌": ["清潔にする", "環境を整える"],
      "除菌": ["靴の内側を整える"],
      "解決": ["向き合う", "試したこと"],
      "完全": ["できる範囲で", "自分なりに"],
      "劇的": ["じわじわと", "少しずつ"],
      "即効": ["じっくりと", "続けることで"]
    }
  }
}
