{
  "meta": {
    "file_number": 34,
    "format": "carousel",
    "carousel_category": "comparison（比較・検証型）",
    "euphemism": "不要（直接表現可）",
    "phase": "均等配置（フェーズ区分なし）",
    "phase_role": "パッケージ2の4番目。初のカルーセル投入。12年間で試した5つの具体的な対策を過去File（03,06,07,14,19）を参照しながら正直に並べ、保存価値の高い比較コンテンツとして提示する。De-selling設計でCTAなし。"
  },
  "purpose": "12年間で試した5つの具体的な対策（5本指ソックス・重曹足湯・消臭スプレー・市販クリーム・インソール交換）を、良くなるとは一度も言わずに正直に並べて提示し、保存・見返す価値のあるコンテンツとして信頼を積み重ねる。CTAなしで情報提供に徹する。",
  "target_state": "足元の悩みを抱え、何らかの対策を試したいと考えている。過去に対策を試して思うような結果を得られなかった経験があるかもしれない。このカルーセルを偶然見かけた状態。直列視聴を前提にしない。",
  "logic": [
    "12年間で試した対策を5つ、時系列ではなく淡々と列挙する",
    "それぞれの対策について、何を試して何が起きたかという事実だけを正直に記述し、良くなるとは一度も言わない",
    "全部試した上で断定していないという誠実な姿勢を最後に示し、保存・見返す価値を残す"
  ],
  "psychology": {
    "entry": "1枚目（表紙）で『12年で試した足元対策、正直に並べてみた』というフックを提示し、比較・検証への興味を引く",
    "exit": "全部試した上で良くなるとは一度も言っていないという誠実な姿勢を提示し、保存・見返したくなる情報価値を残す"
  },
  "carousel_guideline": {
    "slide_count": 7,
    "cover_hook": "安全靴と戦う12年の記録：File.34｜12年で試した足元対策、正直に並べてみました",
    "content_direction": "比較・検証型。5本指ソックス・重曹足湯・消臭スプレー・市販クリーム・インソール交換という5つの対策について、それぞれ何を試して何が起きたかという事実のみを淡々と提示する。良い悪いの断定は一切しない。",
    "closing_message": "全部試した。全部正直に言った。良くなるとは、一度も言っていない。",
    "reference_files": [3, 6, 7, 14, 19],
    "cta_required": false
  },
  "slides": [
    {
      "slide_number": 1,
      "content": "安全靴と戦う12年の記録：File.34を表示。『12年で試した足元対策、正直に並べてみた』というフック文言を配置する。",
      "role": "cover"
    },
    {
      "slide_number": 2,
      "content": "5本指ソックスを試した話（File.03参照）。最初の1週間だけ良い感覚があったが、それ以降は同じ状態が続いた、という事実を淡々と提示する。",
      "role": "content"
    },
    {
      "slide_number": 3,
      "content": "重曹足湯を試した話（File.06参照）。毎晩30分続けるコストと手間の大きさを正直に提示する。継続の負担が大きかったという事実を淡々と描く。",
      "role": "content"
    },
    {
      "slide_number": 4,
      "content": "消臭スプレーを試した話（File.07参照）。汗と混ざってしまい、思うような結果にならなかったという事実を正直に提示する。",
      "role": "content"
    },
    {
      "slide_number": 5,
      "content": "市販クリームを試した話（File.14参照）。塗ると足が滑るだけで、期待していたようなことは起きなかったという事実を正直に提示する。",
      "role": "content"
    },
    {
      "slide_number": 6,
      "content": "インソール交換を試した話（File.19参照）。朝は良い状態でも昼には元の状態に戻っていた、という限界を正直に提示する。",
      "role": "content"
    },
    {
      "slide_number": 7,
      "content": "全部試した。全部正直に言った。良くなるとは、一度も言っていないという締めのメッセージを配置する。",
      "role": "summary"
    }
  ],
  "thumbnail_guideline": {
    "direction": "12年間で試した対策アイテム（靴下・スプレー・クリーム等）を連想させる構図。白・グレー系の背景。余白を多く取る。テキストは比較・検証への興味を引く短文3行。",
    "tone": "誠実・冷静・情報整理",
    "selected_text": ["12年で試した", "対策全部", "正直に比較"]
  },
  "caption": {
    "hook_line": "12年間で試した足元対策を、正直に全部並べてみました。",
    "body": "5本指ソックス、重曹足湯、消臭スプレー、市販クリーム、インソール交換。工場勤務12年の間に試した対策を、順番に正直に振り返りました。\nどれも試した当初は期待していましたが、良くなったと言い切れるものはありませんでした。\n保証するものではなく、あくまで僕自身の体験の記録です。",
    "cta": "参考になれば嬉しいです。よかったら保存しておいてください。",
    "hashtags": ["#安全靴", "#工場勤務", "#足元ケア", "#12年の記録", "#正直レビュー"]
  },
  "tone_and_rules": {
    "persona": "共感共闘型・和男（30代中旬・工場勤務12年・足元の悩みの当事者）",
    "slide_max_chars": 60,
    "sentence_ending": "です・ます",
    "prohibited_words": [
      "効", "治", "消え", "改善", "変わ", "変化", "変え", "解決", "完全", "劇的", "即効",
      "必ず", "絶対", "確実に", "限定", "今だけ", "残りわずか",
      "足のニオイ", "足が臭い", "悪臭", "臭い足", "足臭", "体臭"
    ],
    "one_message": "12年間で試した5つの足元対策を、良くなるとは言わずに正直に並べた記録",
    "numbering": "安全靴と戦う12年の記録：File.34"
  },
  "honesty_rule": {
    "effect_claim": "効果を断定も暗示もしない。「効」「治」「消え」「改善」を含む全活用形は禁止。",
    "guarantee": "保証しない。「必ず」「絶対」「確実に」は禁止。",
    "purchase_pressure": "合わない人が買う確率を下げる設計。購入を急かす・限定感を出す表現は禁止。",
    "tone_consistency": "気にならなくなった・保証しない・よかったら。この3語のトーンを一貫する。"
  },
  "euphemism_dict": {
    "prohibited_direct": [
      "足のニオイ", "足が臭い", "悪臭", "臭い足", "足臭", "体臭",
      "蒸れ臭", "雑菌", "腐敗臭", "発酵臭", "殺菌", "除菌", "ニオイ対策"
    ],
    "conversion_table": {
      "足のニオイ": ["足元の違和感", "足元の悩み"],
      "臭い": ["気になる", "違和感がある"],
      "体臭": ["体の内側の問題", "内側のケア"],
      "蒸れ": ["靴の中の環境", "密閉後の空気"],
      "雑菌": ["蓄積したもの", "靴の内側の問題"],
      "腐敗": ["独特の気配", "あの感覚"],
      "発酵": ["密閉の影響", "靴の中の変化"],
      "ニオイ対策": ["足元ケア", "足元と向き合う"],
      "なくな": ["気にならなくな", "落ち着く"],
      "殺菌": ["清潔にする", "環境を整える"],
      "除菌": ["靴の内側を整える"],
      "解決": ["向き合う", "試したこと"],
      "完全": ["できる範囲で", "自分なりに"],
      "劇的": ["じわじわと", "少しずつ"],
      "即効": ["じっくりと", "続けることで"]
    }
  }
}
