{
  "meta": {
    "file_number": 32,
    "format": "reel",
    "psychology_type": "Type_2（ナラティブ・サスペンス型）",
    "euphemism": "不要（婉曲表現不使用）",
    "phase": "均等配置（フェーズ区分なし）",
    "phase_role": "パッケージ2の3番目。工場の休憩室で、周りの同僚が当たり前のように靴を脱いでくつろぐ中、自分だけ靴を脱げないまま昼休みを過ごしてきたという、当事者にしか分からない行動の共感を提示する。CTAなしで正直さの信頼蓄積を継続する。"
  },
  "purpose": "工場の休憩室で、周りの同僚が当たり前のように靴を脱いでくつろぐ中、自分だけ靴を脱げないまま昼休みを過ごしてきたという行動を可視化し、「自分だけじゃない」という共感とDMシェアを誘発する。CTAなしで正直さの信頼蓄積を継続する。",
  "target_state": "足元の悩みを抱えているが誰にも言えず一人で対処している。休憩中に周りが靴を脱いでくつろぐ中、自分だけ靴を脱げずに過ごした経験がある。このReelsを偶然見かけた状態。直列視聴を前提にしない。",
  "logic": [
    "昼休み、休憩室に入ると同僚たちは当たり前のように靴を脱いでくつろいでいる。自分は靴紐に手をかけたまま、結局脱がずに座る",
    "脱げば楽になると分かっていても、脱いだ瞬間の空気を想像すると手が止まる。この行動は誰にも説明したことがない",
    "1時間の休憩の間、ずっと靴を履いたまま過ごし、チャイムが鳴ってようやくほっとする、この我慢は当事者にしか分からない共通体験"
  ],
  "psychology": {
    "entry": "日常の緊張場面：休憩室に入り、同僚が当たり前のように靴を脱いでくつろぐ中、自分だけ靴紐に手をかけたまま動けなくなる、その一瞬で視聴者を拾う",
    "exit": "自分だけじゃない安心：「自分も休憩中に靴を脱げなかったことがある」という共感による孤独感の緩和"
  },
  "narration_guideline": {
    "direction": "休憩室に入り、同僚たちが当たり前のように靴を脱いでくつろぐ中、自分は靴紐に手をかけたまま結局脱がずに座った、その1時間の我慢を和男の内面独白として語る。周りとの温度差と、脱げない理由を誰にも説明できない孤独感を55〜65字で凝縮。結論や答えは出さず、共感の余韻で終わる。",
    "key_emotion": "我慢（周りは当たり前にくつろぐ中、自分だけ靴を脱げない緊張と疲労感）",
    "opening_approach": "イン・メディアス・レス。休憩室に入り、靴紐に手をかけた瞬間から即座に入る。「足元の悩みがあって…」等の背景説明は一切入れない。"
  },
  "telop_guideline": {
    "direction": "ナレーションの我慢を補完する気づき。「結局、脱がずに座った」という1時間の緊張を短い言葉で視覚的に突きつける。共感の余韻で終わる。CTAなし。",
    "cta_required": false,
    "cta_direction": null
  },
  "thumbnail_guideline": {
    "direction": "工場の休憩室、周りが靴を脱いでくつろぐ中、自分だけ靴紐に手をかけたまま動けない瞬間の緊張感を、当事者だけが分かるフックとして提示",
    "tone": "共感・我慢の静けさ",
    "selected_text": ["脱げなかった", "結局そのまま", "昼休みが終わる"]
  },
  "caption": {
    "hook_line": "休憩室で同僚が靴を脱いでくつろぐ中、僕だけ結局脱がずに昼休みを終えました。",
    "body": "安全靴を12年履いてきた僕にとって、休憩中に靴を脱ぐという当たり前の行動が一番のハードルでした。\n脱げば楽になると分かっていても、脱いだ瞬間の空気を想像すると手が止まる。\n結局、靴紐に手をかけたまま、1時間の昼休みをそのまま座って過ごしていました。",
    "cta": "同じ経験がある方へ。僕が12年間で試したことを、盛らずに全部プロフィールにまとめています。",
    "hashtags": ["#安全靴", "#工場勤務", "#足元ケア", "#休憩室あるある", "#12年の記録"]
  },
  "tone_and_rules": {
    "persona": "共感共闘型・和男（30代中旬・工場勤務12年・足元の悩みの当事者）",
    "narration_duration": "55〜65字",
    "telop_lines": "2〜4行",
    "telop_max_chars_per_line": 10,
    "sentence_ending": "です・ます",
    "prohibited_words": [
      "効", "治", "消え", "改善", "変わ", "変化", "変え", "解決", "完全", "劇的", "即効",
      "必ず", "絶対", "確実に", "限定", "今だけ", "残りわずか",
      "足のニオイ", "足が臭い", "悪臭", "臭い足", "足臭", "体臭"
    ],
    "one_message": "工場の休憩室で、同僚が当たり前のように靴を脱いでくつろぐ中、自分だけ靴を脱げないまま昼休みを過ごしてきた、あなただけじゃない",
    "numbering": "安全靴と戦う12年の記録：File.32"
  },
  "honesty_rule": {
    "effect_claim": "効果を断定も暗示もしない。「効」「治」「消え」「改善」を含む全活用形は禁止。",
    "guarantee": "保証しない。「必ず」「絶対」「確実に」は禁止。",
    "purchase_pressure": "合わない人が買う確率を下げる設計。購入を急かす・限定感を出す表現は禁止。",
    "tone_consistency": "気にならなくなった・保証しない・よかったら。この3語のトーンを一貫する。"
  },
  "euphemism_dict": {
    "prohibited_direct": [
      "足のニオイ", "足が臭い", "悪臭", "臭い足", "足臭", "体臭",
      "蒸れ臭", "雑菌", "腐敗臭", "発酵臭", "殺菌", "除菌", "ニオイ対策"
    ],
    "conversion_table": {
      "足のニオイ": ["足元の違和感", "足元の悩み"],
      "臭い": ["気になる", "違和感がある"],
      "体臭": ["体の内側の問題", "内側のケア"],
      "蒸れ": ["靴の中の環境", "密閉後の空気"],
      "雑菌": ["蓄積したもの", "靴の内側の問題"],
      "腐敗": ["独特の気配", "あの感覚"],
      "発酵": ["密閉の影響", "靴の中の変化"],
      "ニオイ対策": ["足元ケア", "足元と向き合う"],
      "なくな": ["気にならなくな", "落ち着く"],
      "殺菌": ["清潔にする", "環境を整える"],
      "除菌": ["靴の内側を整える"],
      "解決": ["向き合う", "試したこと"],
      "完全": ["できる範囲で", "自分なりに"],
      "劇的": ["じわじわと", "少しずつ"],
      "即効": ["じっくりと", "続けることで"]
    }
  }
}
