{
  "meta": {
    "file_number": 37,
    "format": "carousel",
    "carousel_category": "checklist（チェックリスト型）",
    "euphemism": "不要（直接表現可）",
    "phase": "均等配置（フェーズ区分なし）",
    "phase_role": "パッケージ2の7番目。安全靴で足元がやられやすい人に共通する5つの特徴を、僕自身の12年の経験と照らし合わせながらチェックリスト形式で提示する。読者が自分に当てはまるかを確認できる保存価値の高いコンテンツとして提示する。CTAなしで情報提供に徹する。"
  },
  "purpose": "安全靴で足元がやられやすい人に共通する5つの特徴を、僕自身が全部当てはまっていたという正直な告白とともにチェックリスト形式で提示し、読者が自分の状況を客観視できる保存価値の高いコンテンツとして信頼を積み重ねる。CTAなしで情報提供に徹する。",
  "target_state": "安全靴を履く仕事をしていて、足元の悩みを抱えている。何が原因か分からないまま対策を色々試しても状況が良くならないままの状態。このカルーセルを偶然見かけた状態。直列視聴を前提にしない。",
  "logic": [
    "足元がやられやすい人に共通する5つの特徴を、時系列ではなくチェックリスト形式で淡々と列挙する",
    "それぞれの項目について断定せず、読者自身が『当てはまるかどうか』を確認できる形で提示する",
    "僕自身が5つ全部当てはまっていたという正直な告白を最後に示し、共感と保存価値を残す"
  ],
  "psychology": {
    "entry": "1枚目（表紙）で『安全靴で足がやられる人の共通点5つ』というフックを提示し、チェックリストへの興味と自分ごと化を引き出す",
    "exit": "僕自身が5つ全部当てはまっていたという正直な告白を提示し、共感と保存・見返したくなる情報価値を残す"
  },
  "carousel_guideline": {
    "slide_count": 7,
    "cover_hook": "安全靴と戦う12年の記録：File.37｜安全靴で足がやられる人の共通点5つ",
    "content_direction": "チェックリスト型。①1日8時間以上の密閉環境、②帰宅後の足元ケアをしていない、③靴を1足だけで毎日履いている、④『体質だから仕方ない』と思っている、⑤対策を外側だけで完結させている、という5つの項目を番号付きで淡々と列挙する。断定や説教はせず、読者が自分に当てはまるか確認できる形にする。",
    "closing_message": "僕は5つ全部当てはまっていました。",
    "reference_files": [],
    "cta_required": false
  },
  "slides": [
    {
      "slide_number": 1,
      "content": "安全靴と戦う12年の記録：File.37を表示。『安全靴で足がやられる人の共通点5つ』というフック文言を配置する。",
      "role": "cover"
    },
    {
      "slide_number": 2,
      "content": "①1日8時間以上の密閉環境、という共通点を提示する。安全靴を長時間履き続ける環境そのものが負担になっているという事実を淡々と示す。",
      "role": "content"
    },
    {
      "slide_number": 3,
      "content": "②帰宅後の足元ケアをしていない、という共通点を提示する。仕事から帰った後、足元に手をかける習慣がないまま過ごしているという事実を淡々と示す。",
      "role": "content"
    },
    {
      "slide_number": 4,
      "content": "③靴を1足だけで毎日履いている、という共通点を提示する。同じ靴を休ませずに毎日履き続けているという事実を淡々と示す。",
      "role": "content"
    },
    {
      "slide_number": 5,
      "content": "④『体質だから仕方ない』と思っている、という共通点を提示する。原因を体質のせいにして、それ以上向き合うのをやめてしまっているという事実を淡々と示す。",
      "role": "content"
    },
    {
      "slide_number": 6,
      "content": "⑤対策を外側だけで完結させている、という共通点を提示する。スプレーやパウダーなど外側からの対策だけで終わらせているという事実を淡々と示す。",
      "role": "content"
    },
    {
      "slide_number": 7,
      "content": "僕は5つ全部当てはまっていた、という正直な告白を締めのメッセージとして配置する。",
      "role": "summary"
    }
  ],
  "thumbnail_guideline": {
    "direction": "チェックリストを連想させる構図（✓マークやリスト風のレイアウト）。白・グレー系の背景。余白を多く取る。テキストはチェックリストへの興味と自分ごと化を引く短文。",
    "tone": "誠実・冷静・自分ごと化を促す",
    "selected_text": ["足がやられる", "人の共通点", "5つ"]
  },
  "caption": {
    "hook_line": "安全靴で足元がやられる人に共通する5つの特徴、正直にチェックリストにしてみました。",
    "body": "1日8時間以上の密閉環境、帰宅後のケア不足、靴を1足だけで履き続けること、体質だからと諦めること、対策を外側だけで完結させること。工場勤務12年で気づいた共通点を5つにまとめました。\n僕自身、この5つ全部に当てはまっていました。",
    "cta": "当てはまるものがあれば、参考にしてみてください。見返したくなる日が来るかもしれません。",
    "hashtags": ["#安全靴", "#工場勤務", "#足元ケア", "#12年の記録", "#チェックリスト"]
  },
  "tone_and_rules": {
    "persona": "共感共闘型・和男（30代中旬・工場勤務12年・足元の悩みの当事者）",
    "slide_max_chars": 60,
    "sentence_ending": "です・ます",
    "prohibited_words": [
      "効", "治", "消え", "改善", "変わ", "変化", "変え", "解決", "完全", "劇的", "即効",
      "必ず", "絶対", "確実に", "限定", "今だけ", "残りわずか",
      "足のニオイ", "足が臭い", "悪臭", "臭い足", "足臭", "体臭"
    ],
    "one_message": "安全靴で足がやられる人に共通する5つの特徴を、僕自身の告白とともに示したチェックリスト",
    "numbering": "安全靴と戦う12年の記録：File.37"
  },
  "honesty_rule": {
    "effect_claim": "効果を断定も暗示もしない。「効」「治」「消え」「改善」を含む全活用形は禁止。",
    "guarantee": "保証しない。「必ず」「絶対」「確実に」は禁止。",
    "purchase_pressure": "合わない人が買う確率を下げる設計。購入を急かす・限定感を出す表現は禁止。",
    "tone_consistency": "気にならなくなった・保証しない・よかったら。この3語のトーンを一貫する。"
  },
  "euphemism_dict": {
    "prohibited_direct": [
      "足のニオイ", "足が臭い", "悪臭", "臭い足", "足臭", "体臭",
      "蒸れ臭", "雑菌", "腐敗臭", "発酵臭", "殺菌", "除菌", "ニオイ対策"
    ],
    "conversion_table": {
      "足のニオイ": ["足元の違和感", "足元の悩み"],
      "臭い": ["気になる", "違和感がある"],
      "体臭": ["体の内側の問題", "内側のケア"],
      "蒸れ": ["靴の中の環境", "密閉後の空気"],
      "雑菌": ["蓄積したもの", "靴の内側の問題"],
      "腐敗": ["独特の気配", "あの感覚"],
      "発酵": ["密閉の影響", "靴の中の変化"],
      "ニオイ対策": ["足元ケア", "足元と向き合う"],
      "なくな": ["気にならなくな", "落ち着く"],
      "殺菌": ["清潔にする", "環境を整える"],
      "除菌": ["靴の内側を整える"],
      "解決": ["向き合う", "試したこと"],
      "完全": ["できる範囲で", "自分なりに"],
      "劇的": ["じわじわと", "少しずつ"],
      "即効": ["じっくりと", "続けることで"]
    }
  }
}
