{
  "meta": {
    "file_number": 60,
    "format": "carousel",
    "carousel_category": "warning（警告・逆効果型）",
    "euphemism": "不要（直接表現可）",
    "phase": "均等配置（フェーズ区分なし）",
    "phase_role": "パッケージ1・2全60本の最終作、かつ警告カテゴリ3本（File.40／File.50／File.60）の締め。File.40（良かれと思って続けていた日常習慣3つの告白）、File.50（見落としがちな落とし穴3つの告白）は、いずれも『自分の特定の行動・意識の抜け』を個別列挙する構成だったのに対し、本作は個別の行動ではなく、12年間で試した数多くの対策そのものに共通する『パターン』（①最初だけ手応えを感じるもの、②手間がかかりすぎて続かないもの、③問題を隠すだけで根本に触れないもの）という抽象化された構造を提示する点で異なる。またFile.57（チェックリスト型）がカテゴリごとに『続けてよかった／やめてよかった』という個別の実践結果を淡々と列挙したのに対し、本作はその総括として『対策全体に共通する失敗の型』を提示し、最終スライドで『じゃあ何が正解か、まだ分からない』という60作を通じて到達した正直さ=(1)の結論で締める、パッケージ全体の総括としての役割を持つ。表現面では『告白』『見落とし』『結論』ではなく『パターン』『末路』『まだ分からない』を独自のキーワードとして展開し、既存の警告型・チェック型カルーセルとの語彙・骨格の近接を避ける。CTAなしで正直さの信頼蓄積を完結させる。"
  },
  "purpose": "12年間で試してきた数々の対策を振り返り、『やめた方がいい対策』に共通する3つのパターン（①最初だけ手応えを感じるもの、②手間がかかりすぎて続かないもの、③問題を隠すだけで根本に触れないもの）を提示する。個別の対策名を挙げるのではなく、全60作を通じて蓄積した体験を抽象化した構造として示し、『じゃあ何が正解か、正直に言うとまだ分からない。でもやめた方がいいことは分かった』という結論で、パッケージ全体を締めくくる。",
  "target_state": "安全靴を履く仕事をしていて、これまで様々な対策を試してきたが、うまくいかなかった対策に共通する理由を整理したことはない状態。このカルーセルを偶然見かけた状態。直列視聴を前提にしない。",
  "logic": [
    "12年間で試してきた数々の対策を振り返り、うまくいかなかったものに共通する3つのパターン（①最初だけ手応えを感じるもの、②手間がかかりすぎて続かないもの、③問題を隠すだけで根本に触れないもの）を抽出して提示する",
    "この3パターンに当てはまる対策は、12年間の中で全部同じ末路をたどったという事実を淡々と示す",
    "『じゃあ何が正解か、正直に言うとまだ分からない。でも「やめた方がいいこと」は分かった』という締めで、60作を通じて到達した正直さの結論を提示する"
  ],
  "psychology": {
    "entry": "1枚目（表紙）で『12年の記録で分かった、やめた方がいい対策の共通パターン』というフックを提示し、これまで色々な対策を試してきたが共通点を意識したことがない読者の関心を引く",
    "exit": "『やめた方がいいことは分かった。それが12年の記録』という結論を最終スライドで残し、正解を断定しない正直さのまま、読者が自分の対策を振り返るきっかけを作る"
  },
  "carousel_guideline": {
    "slide_count": 7,
    "cover_hook": "安全靴と戦う12年の記録：File.60｜12年の記録で分かった、やめた方がいい対策の共通パターン",
    "content_direction": "warning型。①最初だけ手応えを感じるもの、②手間がかかりすぎて続かないもの、③問題を『隠す』だけで根本に触れないもの、という3つのパターンを番号付きで淡々と提示する。個別の商品名や対策名は挙げず、あくまで12年間の体験から抽出した構造として示す。断定的な警告ではなく、正直な振り返りとして提示する。",
    "closing_message": "じゃあ何が正解か。正直に言います。まだ分かりません。でも「やめた方がいいこと」は分かりました。それが12年の記録です。",
    "reference_files": [1, 30, 40, 50],
    "cta_required": false
  },
  "slides": [
    {
      "slide_number": 1,
      "content": "安全靴と戦う12年の記録：File.60を表示。『12年の記録で分かった、やめた方がいい対策の共通パターン』というフック文言を配置する。パッケージ1・2全60作の締めであることが伝わるトーンにする。",
      "role": "cover",
      "expression": "troubled"
    },
    {
      "slide_number": 2,
      "content": "パターン①：最初だけ手応えを感じるもの、を提示する。使い始めの数日だけ手応えを感じたが、それ以降は何も感じなくなったという傾向を淡々と示す。",
      "role": "content"
    },
    {
      "slide_number": 3,
      "content": "パターン②：手間がかかりすぎて続かないもの、を提示する。工程が多い・時間がかかるなどの理由で、結局長続きしなかったという傾向を淡々と示す。",
      "role": "content"
    },
    {
      "slide_number": 4,
      "content": "パターン③：問題を『隠す』だけで根本に触れないもの、を提示する。一時的にごまかせても、根本的な部分には触れていなかったという傾向を淡々と示す。",
      "role": "content"
    },
    {
      "slide_number": 5,
      "content": "この3パターンに当てはまる対策は、僕の12年間で全部同じ末路をたどったという事実を提示する。",
      "role": "content"
    },
    {
      "slide_number": 6,
      "content": "『じゃあ何が正解か。正直に言う。まだ分からない』という率直な告白を配置する。断定せず、あくまで12年経っても分からないままの部分として示す。",
      "role": "personal_comment"
    },
    {
      "slide_number": 7,
      "content": "『でも「やめた方がいいこと」は分かった。それが12年の記録』という締めのメッセージを配置する。パッケージ全体を通じて到達した正直さの結論として示す。",
      "role": "summary",
      "expression": "wry"
    }
  ],
  "thumbnail_guideline": {
    "direction": "12年分の記録が積み重なったことを連想させる落ち着いた構図（ノートや記録帳、あるいは重なった線を連想させる要素）。白・グレー系の背景に控えめなアンバー系のアクセント。余白を多く取る。テキストは60作を通じて辿り着いた結論という重みを伝える短文。過度な煽りは避ける。",
    "tone": "誠実・冷静・総括（煽りではない）",
    "selected_text": ["12年の記録", "やめた方が", "いい対策の", "共通パターン"]
  },
  "caption": {
    "hook_line": "12年間の記録から見えてきた、やめた方がいい対策の共通パターンをまとめました。",
    "body": "工場勤務12年の中で、本当に色々な対策を試してきました。\nうまくいかなかったものを振り返ると、いくつか共通するパターンがあることに気づきました。\nじゃあ何が正解か、正直に言うとまだ分かりません。それでも「やめた方がいいこと」は分かった、というのがこの12年の記録です。",
    "cta": "",
    "hashtags": ["#安全靴", "#工場勤務", "#足元ケア", "#12年の記録", "#正直レビュー"]
  },
  "tone_and_rules": {
    "persona": "共感共闘型・和男（30代中旬・工場勤務12年・足元の悩みの当事者）",
    "slide_max_chars": 60,
    "sentence_ending": "です・ます",
    "prohibited_words": [
      "効", "治", "消え", "改善", "変わ", "変化", "変え", "解決", "完全", "劇的", "即効",
      "必ず", "絶対", "確実に", "限定", "今だけ", "残りわずか",
      "足のニオイ", "足が臭い", "悪臭", "臭い足", "足臭", "体臭"
    ],
    "one_message": "12年間で試した数々の対策を振り返り、やめた方がいい対策に共通する3つのパターンを抽出した上で、『正解はまだ分からないが、やめた方がいいことは分かった』という正直さの結論に到達したカルーセル",
    "numbering": "安全靴と戦う12年の記録：File.60"
  },
  "honesty_rule": {
    "effect_claim": "効果を断定も暗示もしない。「効」「治」「消え」「改善」を含む全活用形は禁止。",
    "guarantee": "保証しない。「必ず」「絶対」「確実に」は禁止。",
    "purchase_pressure": "合わない人が買う確率を下げる設計。購入を急かす・限定感を出す表現は禁止。",
    "tone_consistency": "気にならなくなった・保証しない・よかったら。この3語のトーンを一貫する。"
  },
  "euphemism_dict": {
    "prohibited_direct": [
      "足のニオイ", "足が臭い", "悪臭", "臭い足", "足臭", "体臭",
      "蒸れ臭", "雑菌", "腐敗臭", "発酵臭", "殺菌", "除菌", "ニオイ対策"
    ],
    "conversion_table": {
      "足のニオイ": ["足元の違和感", "足元の悩み"],
      "臭い": ["気になる", "違和感がある"],
      "体臭": ["体の内側の問題", "内側のケア"],
      "蒸れ": ["靴の中の環境", "密閉後の空気"],
      "雑菌": ["蓄積したもの", "靴の内側の問題"],
      "腐敗": ["独特の気配", "あの感覚"],
      "発酵": ["密閉の影響", "靴の中の変化"],
      "ニオイ対策": ["足元ケア", "足元と向き合う"],
      "なくな": ["気にならなくな", "落ち着く"],
      "殺菌": ["清潔にする", "環境を整える"],
      "除菌": ["靴の内側を整える"],
      "解決": ["向き合う", "試したこと"],
      "完全": ["できる範囲で", "自分なりに"],
      "劇的": ["じわじわと", "少しずつ"],
      "即効": ["じっくりと", "続けることで"]
    }
  }
}
