{
  "meta": {
    "file_number": 57,
    "format": "carousel",
    "carousel_category": "checklist（チェックリスト型）",
    "euphemism": "不要（直接表現可）",
    "phase": "均等配置（フェーズ区分なし）",
    "phase_role": "パッケージ2のチェックリストカテゴリ3本（File.37／File.47／File.57）の最終作。File.37（足元がやられやすい人に共通する特徴の列挙）、File.47（12年間の対策費用の金額換算）とは異なり、本作は『外側からの対策』という手段そのものを振り返り、各カテゴリごとに『続けてよかった／やめてよかった』という結論だけを淡々と提示する構成にする。File.34／File.44／File.54（比較・検証型）で採用したコスト・持続時間という数値軸による比較表現や、File.50（警告型）の『落とし穴』提示パターンは踏襲せず、本作は数値比較でも警告でもなく、あくまで個人の12年間の実践結果としての『結論の是非』だけを短く言い切る文体を採用することで、過去のカルーセル回と言い回し・構成が近接しないよう差別化する。"
  },
  "purpose": "外側からの対策（消臭スプレー・ミスト系、防臭靴下・五本指ソックス系、インソール交換、乾燥剤・重曹ボールなど靴内アイテム系、特殊繊維の高価な靴下やテーピングなど上位アイテム系）について、12年間続けてきた末にたどり着いた『続けてよかった』『やめてよかった』という結論だけを、カテゴリごとに正直に並べる。数値の比較や優劣の断定はせず、あくまで個人の実践結果として提示し、保存・見返す価値のある実用コンテンツとして信頼を積み重ねる。",
  "target_state": "安全靴を履く仕事をしていて、消臭スプレーや靴下、インソールなど外側からの対策をいくつか試してきたが、それぞれの手応えを振り返って整理したことはない状態。このカルーセルを偶然見かけた状態。直列視聴を前提にしない。",
  "logic": [
    "12年間試してきた外側からの対策をカテゴリごとに振り返り、それぞれについて『続けてよかったか、やめてよかったか』という結論だけを淡々と提示する",
    "個別のアイテムを検証・比較するのではなく、12年続けた末に和男自身がたどり着いた実践上の結論として淡々と示す",
    "『外側の対策だけで全部に納得できたわけではないが、続けてきた記録として残しておきたい』という締めで、読者自身の振り返りに委ねる"
  ],
  "psychology": {
    "entry": "1枚目（表紙）で『外側の対策を12年試した僕の結論チェックリスト』というフックを提示し、自分も同じように色々試してきたが整理できていない読者の共感を引き出す",
    "exit": "『外側の対策だけで全部に納得できたわけではないが、続けてきた記録として残しておきたい』という締めを最終スライドで残し、読者が自分のこれまでの対策を振り返るきっかけを作る"
  },
  "carousel_guideline": {
    "slide_count": 7,
    "cover_hook": "安全靴と戦う12年の記録：File.57｜外側の対策を12年試した僕の結論チェックリスト",
    "content_direction": "checklist型。①消臭スプレー・ミスト系、②防臭靴下・五本指ソックス系、③インソール交換、④乾燥剤・重曹ボールなど靴内アイテム系、⑤特殊繊維の高価な靴下やテーピングなど上位アイテム系という5つのカテゴリについて、それぞれ『続けてよかった』か『やめてよかった』のどちらかの結論だけを淡々と提示する。数値による比較や優劣の断定はせず、あくまで12年間の実践結果としての結論だけを列挙する。",
    "closing_message": "外側の対策だけで全部に納得できたわけではありません。それでも続けてきた記録として残しておきます。",
    "reference_files": [37, 47, 53, 54],
    "cta_required": false
  },
  "slides": [
    {
      "slide_number": 1,
      "content": "安全靴と戦う12年の記録：File.57を表示。『外側の対策を12年試した僕の結論チェックリスト』というフック文言を配置する。",
      "role": "cover",
      "expression": "troubled"
    },
    {
      "slide_number": 2,
      "content": "①消臭スプレー・ミスト系について提示する。12年間続けてきた結果、『続けてよかった』という結論を淡々と示す。習慣として取り入れやすかったという理由を添える。",
      "role": "content"
    },
    {
      "slide_number": 3,
      "content": "②防臭靴下・五本指ソックス系について提示する。12年間続けてきた結果、『続けてよかった』という結論を淡々と示す。靴下を替えるだけで始めやすかったという理由を添える。",
      "role": "content"
    },
    {
      "slide_number": 4,
      "content": "③インソール交換について提示する。『続けてよかった』という結論を示しつつ、過度な期待はしていなかったという正直な留保を添える。",
      "role": "content"
    },
    {
      "slide_number": 5,
      "content": "④乾燥剤・重曹ボールなど靴内アイテム系について提示する。『どちらでもよかった』という結論を淡々と示す。大きな体感差はなかったという事実を添える。",
      "role": "content"
    },
    {
      "slide_number": 6,
      "content": "⑤特殊繊維の高価な靴下やテーピングなど上位アイテム系について提示する。『やめてよかった』という結論を淡々と示す。コストに見合う手応えは感じられなかったという事実を添える。",
      "role": "content"
    },
    {
      "slide_number": 7,
      "content": "『外側の対策だけで全部に納得できたわけではない。それでも続けてきた記録として残しておきたい』という締めのメッセージを配置する。",
      "role": "summary",
      "expression": "relieved"
    }
  ],
  "thumbnail_guideline": {
    "direction": "5つのアイテムカテゴリをチェックリスト形式で並べたような構図（チェックボックスやリスト風のレイアウトを連想させる）。白・グレー系の背景に余白を多く取る。テキストは12年の実践の結論という信頼感を伝える短文。過度な煽りは避ける。",
    "tone": "誠実・冷静・実用的（煽りではない）",
    "selected_text": ["外側の対策", "12年の記録", "結論だけを", "事実を提示"]
  },
  "caption": {
    "hook_line": "外側の対策を12年試してきた僕の結論だけを、チェックリストとしてまとめました。",
    "body": "工場勤務12年の中で、消臭スプレーや靴下、インソールなど外側からの対策をいろいろ試してきました。\n今回はその中から代表的なカテゴリを選び、続けてよかったこと、やめてよかったことを結論だけ正直に並べてみました。\n数値の比較ではなく、あくまで僕自身がたどり着いた実践上の結論です。",
    "cta": "",
    "hashtags": ["#安全靴", "#工場勤務", "#足元ケア", "#12年の記録", "#外側の対策"]
  },
  "tone_and_rules": {
    "persona": "共感共闘型・和男（30代中旬・工場勤務12年・足元の悩みの当事者）",
    "slide_max_chars": 60,
    "sentence_ending": "です・ます",
    "prohibited_words": [
      "効", "治", "消え", "改善", "変わ", "変化", "変え", "解決", "完全", "劇的", "即効",
      "必ず", "絶対", "確実に", "限定", "今だけ", "残りわずか",
      "足のニオイ", "足が臭い", "悪臭", "臭い足", "足臭", "体臭"
    ],
    "one_message": "外側からの対策を12年試してきた和男が、続けてよかったこと・やめてよかったことを結論だけ正直に並べたカルーセル",
    "numbering": "安全靴と戦う12年の記録：File.57"
  },
  "honesty_rule": {
    "effect_claim": "効果を断定も暗示もしない。「効」「治」「消え」「改善」を含む全活用形は禁止。",
    "guarantee": "保証しない。「必ず」「絶対」「確実に」は禁止。",
    "purchase_pressure": "合わない人が買う確率を下げる設計。購入を急かす・限定感を出す表現は禁止。",
    "tone_consistency": "気にならなくなった・保証しない・よかったら。この3語のトーンを一貫する。"
  },
  "euphemism_dict": {
    "prohibited_direct": [
      "足のニオイ", "足が臭い", "悪臭", "臭い足", "足臭", "体臭",
      "蒸れ臭", "雑菌", "腐敗臭", "発酵臭", "殺菌", "除菌", "ニオイ対策"
    ],
    "conversion_table": {
      "足のニオイ": ["足元の違和感", "足元の悩み"],
      "臭い": ["気になる", "違和感がある"],
      "体臭": ["体の内側の問題", "内側のケア"],
      "蒸れ": ["靴の中の環境", "密閉後の空気"],
      "雑菌": ["蓄積したもの", "靴の内側の問題"],
      "腐敗": ["独特の気配", "あの感覚"],
      "発酵": ["密閉の影響", "靴の中の変化"],
      "ニオイ対策": ["足元ケア", "足元と向き合う"],
      "なくな": ["気にならなくな", "落ち着く"],
      "殺菌": ["清潔にする", "環境を整える"],
      "除菌": ["靴の内側を整える"],
      "解決": ["向き合う", "試したこと"],
      "完全": ["できる範囲で", "自分なりに"],
      "劇的": ["じわじわと", "少しずつ"],
      "即効": ["じっくりと", "続けることで"]
    }
  }
}
