{
  "meta": {
    "file_number": 44,
    "format": "carousel",
    "carousel_category": "comparison（比較・検証型）",
    "euphemism": "不要（直接表現可）",
    "phase": "均等配置（フェーズ区分なし）",
    "phase_role": "パッケージ2の比較・検証カテゴリ3本（File.34／File.44／File.54）の中間作。File.41（足用石鹸3種を使い比べた正直な感想・リール）の内容を拡張し、石鹸・スプレー・パウダーという3カテゴリ全体を横断的に整理する保存狙いのカルーセル。断定は一切しない。"
  },
  "purpose": "12年間で試してきた足用石鹸・消臭スプレー・消臭パウダーという3カテゴリの製品を正直に比較し、『どれも決定打にはならなかった』という事実と『マシだった順』を提示する。File.41（石鹸単体の感想）を拡張し、カテゴリ横断の使い分けガイドとして保存価値の高いコンテンツにする。断定・保証は一切しない。",
  "target_state": "安全靴を履く仕事をしていて、足用石鹸・消臭スプレー・消臭パウダーのどれを選べばいいか迷っている。一つの製品だけ試して他のカテゴリを知らない、あるいはまだ自分に合うものを見つけられていない状態。このカルーセルを偶然見かけた状態。直列視聴を前提にしない。",
  "logic": [
    "足用石鹸3種・消臭スプレー3種・消臭パウダー2種、それぞれの使用感（洗浄力／コスト／手間、使い始めの手応え／持続／副作用、体感の強さ／汚れ／コスト）を正直に比較列挙する",
    "12年使い比べてきた率直な感想として『どれも決定打にはならなかった』という事実を提示し、その上で『マシだった』順に並べる",
    "合う合わないは人によるという前提を明示し、保証しないという誠実な締めで読者自身の判断を促す"
  ],
  "psychology": {
    "entry": "1枚目（表紙）で『足用石鹸・スプレー・パウダー 正直な使い分けガイド』というフックを提示し、『どれを選べばいいか迷っている』読者の意思決定ニーズを引き出す",
    "exit": "『マシだった』順を示しつつ、『合う合わないは人による、僕の体感であって保証はしない』という誠実な締めを提示し、実用情報として保存させる動機を残す"
  },
  "carousel_guideline": {
    "slide_count": 7,
    "cover_hook": "安全靴と戦う12年の記録：File.44｜足用石鹸・スプレー・パウダー 正直な使い分けガイド",
    "content_direction": "comparison型。①足用石鹸3種（洗浄力・コスト・手間）、②消臭スプレー3種（使い始めの手応え・持続・副作用）、③消臭パウダー2種（体感の強さ・汚れ・コスト）という3カテゴリを軸ごとに正直に比較提示する。断定や優劣の決めつけはせず、使用感の違いを淡々と示す。File.41（石鹸単体の感想）の内容を土台に、カテゴリを横断して整理する。",
    "closing_message": "どれも決定打にはなりませんでした。ただし、合う合わないは人によります。僕の体感であって、保証はしません。",
    "reference_files": [41],
    "cta_required": false
  },
  "slides": [
    {
      "slide_number": 1,
      "content": "安全靴と戦う12年の記録：File.44を表示。『足用石鹸・スプレー・パウダー 正直な使い分けガイド』というフック文言を配置する。",
      "role": "cover"
    },
    {
      "slide_number": 2,
      "content": "足用石鹸3種の使用感を提示する。洗浄力・コスト・手間という3つの軸で、それぞれの違いを淡々と比較する（File.41参照・拡張）。",
      "role": "content"
    },
    {
      "slide_number": 3,
      "content": "消臭スプレー3種の使用感を提示する。使い始めの手応え・持続・副作用という3つの軸で、それぞれの違いを淡々と比較する。",
      "role": "content"
    },
    {
      "slide_number": 4,
      "content": "消臭パウダー2種の使用感を提示する。体感の強さ・汚れ・コストという3つの軸で、それぞれの違いを淡々と比較する。",
      "role": "content"
    },
    {
      "slide_number": 5,
      "content": "12年使い比べてきた率直な感想として、石鹸もスプレーもパウダーも、どれも決定打にはならなかったという事実を提示する。",
      "role": "content"
    },
    {
      "slide_number": 6,
      "content": "それでも『マシだった』と感じた順に並べるとどうなるかを提示する。断定的な優劣ではなく、あくまで体感の順番として示す。",
      "role": "content"
    },
    {
      "slide_number": 7,
      "content": "合う合わないは人による、これは僕の体感であって保証はしない、という締めのメッセージを配置する。",
      "role": "summary"
    }
  ],
  "thumbnail_guideline": {
    "direction": "比較・使い分けを想起させる整理された構図。白・グレー系の背景をベースに、余白を多く取る。3カテゴリを横断して比べている印象を与える落ち着いたレイアウト。過度な煽りは避ける。",
    "tone": "誠実・冷静・実用的（煽りではない）",
    "selected_text": ["石鹸と", "スプレー", "パウダー", "正直な使い分け"]
  },
  "caption": {
    "hook_line": "足用石鹸・消臭スプレー・消臭パウダー、12年使い比べた正直な感想をまとめました。",
    "body": "工場勤務12年の中で、足用石鹸・消臭スプレー・消臭パウダーを一通り試してきました。\n正直に言うと、どれも決定打にはなりませんでした。\nそれでも『マシだった』と感じた順はあります。\n合う合わないは人によるので、あくまで一つの参考にしてもらえたらと思います。",
    "cta": "自分に合うものを探す参考にしてみてください。",
    "hashtags": ["#安全靴", "#工場勤務", "#足元ケア", "#12年の記録", "#正直レビュー"]
  },
  "tone_and_rules": {
    "persona": "共感共闘型・和男（30代中旬・工場勤務12年・足元の悩みの当事者）",
    "slide_max_chars": 60,
    "sentence_ending": "です・ます",
    "prohibited_words": [
      "効", "治", "消え", "改善", "変わ", "変化", "変え", "解決", "完全", "劇的", "即効",
      "必ず", "絶対", "確実に", "限定", "今だけ", "残りわずか",
      "足のニオイ", "足が臭い", "悪臭", "臭い足", "足臭", "体臭"
    ],
    "one_message": "足用石鹸・消臭スプレー・消臭パウダーを12年使い比べた結果、どれも決定打にはならなかったという正直な比較",
    "numbering": "安全靴と戦う12年の記録：File.44"
  },
  "honesty_rule": {
    "effect_claim": "効果を断定も暗示もしない。「効」「治」「消え」「改善」を含む全活用形は禁止。",
    "guarantee": "保証しない。「必ず」「絶対」「確実に」は禁止。",
    "purchase_pressure": "合わない人が買う確率を下げる設計。購入を急かす・限定感を出す表現は禁止。",
    "tone_consistency": "気にならなくなった・保証しない・よかったら。この3語のトーンを一貫する。"
  },
  "euphemism_dict": {
    "prohibited_direct": [
      "足のニオイ", "足が臭い", "悪臭", "臭い足", "足臭", "体臭",
      "蒸れ臭", "雑菌", "腐敗臭", "発酵臭", "殺菌", "除菌", "ニオイ対策"
    ],
    "conversion_table": {
      "足のニオイ": ["足元の違和感", "足元の悩み"],
      "臭い": ["気になる", "違和感がある"],
      "体臭": ["体の内側の問題", "内側のケア"],
      "蒸れ": ["靴の中の環境", "密閉後の空気"],
      "雑菌": ["蓄積したもの", "靴の内側の問題"],
      "腐敗": ["独特の気配", "あの感覚"],
      "発酵": ["密閉の影響", "靴の中の変化"],
      "ニオイ対策": ["足元ケア", "足元と向き合う"],
      "なくな": ["気にならなくな", "落ち着く"],
      "殺菌": ["清潔にする", "環境を整える"],
      "除菌": ["靴の内側を整える"],
      "解決": ["向き合う", "試したこと"],
      "完全": ["できる範囲で", "自分なりに"],
      "劇的": ["じわじわと", "少しずつ"],
      "即効": ["じっくりと", "続けることで"]
    }
  }
}
