{
  "meta": {
    "file_number": 47,
    "format": "carousel",
    "carousel_category": "checklist（チェックリスト型）",
    "euphemism": "不要（直接表現可）",
    "phase": "均等配置（フェーズ区分なし）",
    "phase_role": "パッケージ2のチェックリストカテゴリ3本（File.37／File.47／File.57）の中間作。File.37（足元がやられやすい人に共通する特徴のチェックリスト）、File.57（結論としてのチェックリスト）とは異なり、12年間で対策に使ってきた費用を項目ごとに金額換算して振り返るという新しい切り口。断定はせず、あくまで和男自身の実際の概算として淡々と提示する。"
  },
  "purpose": "12年間で足元の対策に使ってきた費用（消臭スプレー代・靴下買い替え代・インソール代・その他）を項目ごとに金額換算し、合計金額を和男自身の実際の概算として提示する。断定や煽りは一切せず、『この金額が正解かどうかは分からないが、計算してみたら目が覚めた』という正直な気づきを保存価値の高いコンテンツとして届ける。",
  "target_state": "安全靴を履く仕事をしていて、足元の対策に何かしらお金をかけている。ただし累計でいくら使ったかを具体的に計算したことはない状態。このカルーセルを偶然見かけた状態。直列視聴を前提にしない。",
  "logic": [
    "消臭スプレー代・靴下買い替え代・インソール代・その他（石鹸・パウダー・クリーム・足湯器等）を、それぞれ12年分の概算金額として項目ごとに淡々と提示する",
    "各項目を合計し、12年間の総額を和男自身の実際の概算として示す",
    "この金額が『正解』かどうかは分からないという正直な留保を示しつつ、計算してみて目が覚めたという気づきで締める"
  ],
  "psychology": {
    "entry": "1枚目（表紙）で『足元の対策に12年でいくら使ったか計算してみた』というフックを提示し、読者自身も気になっている累計コストへの興味を引き出す",
    "exit": "合計金額を示した上で『この金額が正解かどうかは分からない。でも計算してみたら目が覚めた』という正直な気づきを提示し、読者が自分の出費を振り返るきっかけとして保存させる"
  },
  "carousel_guideline": {
    "slide_count": 7,
    "cover_hook": "安全靴と戦う12年の記録：File.47｜足元の対策に12年でいくら使ったか計算してみた",
    "content_direction": "checklist型。①消臭スプレー代（月○円×12年）、②靴下買い替え代（年○足×12年）、③インソール代（年○回交換×12年）、④その他（石鹸・パウダー・クリーム・足湯器等）という4項目を金額換算しながら順に列挙し、⑤合計金額を和男の実際の概算として提示する。断定的な『正解』としては出さず、あくまで一つの記録として淡々と示す。",
    "closing_message": "この金額が『正解』かどうかは分かりません。でも、計算してみたら目が覚めました。",
    "reference_files": [],
    "cta_required": false
  },
  "slides": [
    {
      "slide_number": 1,
      "content": "安全靴と戦う12年の記録：File.47を表示。『足元の対策に12年でいくら使ったか計算してみた』というフック文言を配置する。",
      "role": "cover"
    },
    {
      "slide_number": 2,
      "content": "消臭スプレー代を提示する。月々の金額を12年分に換算した概算金額を淡々と示す。",
      "role": "content"
    },
    {
      "slide_number": 3,
      "content": "靴下買い替え代を提示する。年間の買い替え足数を12年分に換算した概算金額を淡々と示す。",
      "role": "content"
    },
    {
      "slide_number": 4,
      "content": "インソール代を提示する。年間の交換回数を12年分に換算した概算金額を淡々と示す。",
      "role": "content"
    },
    {
      "slide_number": 5,
      "content": "その他の費用（石鹸・パウダー・クリーム・足湯器等）を提示する。細々とした出費も12年分でまとめて示す。",
      "role": "content"
    },
    {
      "slide_number": 6,
      "content": "①〜④の合計金額を、和男の実際の概算として提示する。断定的な『正解』としてではなく、あくまで一つの記録として示す。",
      "role": "content"
    },
    {
      "slide_number": 7,
      "content": "この金額が『正解』かどうかは分からない、でも計算してみたら目が覚めた、という正直な気づきを締めのメッセージとして配置する。",
      "role": "summary"
    }
  ],
  "thumbnail_guideline": {
    "direction": "電卓や家計簿を連想させる構図。白・グレー系の背景。余白を多く取る。テキストは累計費用への興味を引く短文。過度な煽りは避ける。",
    "tone": "誠実・冷静・自分ごと化を促す",
    "selected_text": ["12年間", "の対策費", "いくら", "使ったか"]
  },
  "caption": {
    "hook_line": "足元の対策に12年でいくら使ったか、実際に計算してみました。",
    "body": "消臭スプレー、靴下、インソール、その他の細々した出費まで、工場勤務12年分を金額換算してみました。\n正直、計算してみるまで自分でも把握していませんでした。",
    "cta": "この金額が正解かどうかは分かりません。参考程度に見てもらえたらと思います。",
    "hashtags": ["#安全靴", "#工場勤務", "#足元ケア", "#12年の記録", "#家計"]
  },
  "tone_and_rules": {
    "persona": "共感共闘型・和男（30代中旬・工場勤務12年・足元の悩みの当事者）",
    "slide_max_chars": 60,
    "sentence_ending": "です・ます",
    "prohibited_words": [
      "効", "治", "消え", "改善", "変わ", "変化", "変え", "解決", "完全", "劇的", "即効",
      "必ず", "絶対", "確実に", "限定", "今だけ", "残りわずか",
      "足のニオイ", "足が臭い", "悪臭", "臭い足", "足臭", "体臭"
    ],
    "one_message": "足元の対策に12年間でかかった費用を項目ごとに金額換算し、合計を正直に示したチェックリスト",
    "numbering": "安全靴と戦う12年の記録：File.47"
  },
  "honesty_rule": {
    "effect_claim": "効果を断定も暗示もしない。「効」「治」「消え」「改善」を含む全活用形は禁止。",
    "guarantee": "保証しない。「必ず」「絶対」「確実に」は禁止。",
    "purchase_pressure": "合わない人が買う確率を下げる設計。購入を急かす・限定感を出す表現は禁止。",
    "tone_consistency": "気にならなくなった・保証しない・よかったら。この3語のトーンを一貫する。"
  },
  "euphemism_dict": {
    "prohibited_direct": [
      "足のニオイ", "足が臭い", "悪臭", "臭い足", "足臭", "体臭",
      "蒸れ臭", "雑菌", "腐敗臭", "発酵臭", "殺菌", "除菌", "ニオイ対策"
    ],
    "conversion_table": {
      "足のニオイ": ["足元の違和感", "足元の悩み"],
      "臭い": ["気になる", "違和感がある"],
      "体臭": ["体の内側の問題", "内側のケア"],
      "蒸れ": ["靴の中の環境", "密閉後の空気"],
      "雑菌": ["蓄積したもの", "靴の内側の問題"],
      "腐敗": ["独特の気配", "あの感覚"],
      "発酵": ["密閉の影響", "靴の中の変化"],
      "ニオイ対策": ["足元ケア", "足元と向き合う"],
      "なくな": ["気にならなくな", "落ち着く"],
      "殺菌": ["清潔にする", "環境を整える"],
      "除菌": ["靴の内側を整える"],
      "解決": ["向き合う", "試したこと"],
      "完全": ["できる範囲で", "自分なりに"],
      "劇的": ["じわじわと", "少しずつ"],
      "即効": ["じっくりと", "続けることで"]
    }
  }
}
